No.     Time           Source                Destination           Protocol Length Info
    700 7.629026       10.170.80.156         10.170.80.99          HTTP     60     HTTP/1.1 100 Continue 

Frame 700: 60 bytes on wire (480 bits), 60 bytes captured (480 bits) on interface 0
Ethernet II, Src: Kyocera_b1:75:be (00:c0:ee:b1:75:be), Dst: LiteonTe_0d:11:e8 (74:de:2b:0d:11:e8)
Internet Protocol Version 4, Src: 10.170.80.156, Dst: 10.170.80.99
Transmission Control Protocol, Src Port: 9090, Dst Port: 63733, Seq: 24, Ack: 328, Len: 2
[3 Reassembled TCP Segments (25 bytes): #697(21), #698(2), #700(2)]
    [Frame: 697, payload: 0-20 (21 bytes)]
    [Frame: 698, payload: 21-22 (2 bytes)]
    [Frame: 700, payload: 23-24 (2 bytes)]
    [Segment count: 3]
    [Reassembled TCP length: 25]
    [Reassembled TCP Data: 485454502f312e312031303020436f6e74696e75650d0a0d...]
Hypertext Transfer Protocol
    HTTP/1.1 100 Continue\r\n
    \r\n
    [HTTP response 1/2]
    [Next request in frame: 702]
    [Next response in frame: 710]

No.     Time           Source                Destination           Protocol Length Info
    702 7.629243       10.170.80.99          10.170.80.156         HTTP/XML 806    POST /ws/km-wsdl/security/authentication_authorization HTTP/1.1 

Frame 702: 806 bytes on wire (6448 bits), 806 bytes captured (6448 bits) on interface 0
Ethernet II, Src: LiteonTe_0d:11:e8 (74:de:2b:0d:11:e8), Dst: Kyocera_b1:75:be (00:c0:ee:b1:75:be)
Internet Protocol Version 4, Src: 10.170.80.99, Dst: 10.170.80.156
Transmission Control Protocol, Src Port: 63733, Dst Port: 9090, Seq: 328, Ack: 26, Len: 752
[2 Reassembled TCP Segments (1079 bytes): #691(327), #702(752)]
    [Frame: 691, payload: 0-326 (327 bytes)]
    [Frame: 702, payload: 327-1078 (752 bytes)]
    [Segment count: 2]
    [Reassembled TCP length: 1079]
    [Reassembled TCP Data: 504f5354202f77732f6b6d2d7773646c2f73656375726974...]
Hypertext Transfer Protocol
    POST /ws/km-wsdl/security/authentication_authorization HTTP/1.1\r\n
    User-Agent: Mozilla/4.0 (compatible; MSIE 6.0; Windows NT 5.1; SV1; ..NET CLR 1.1.4322; InfoPath.1; .NET CLR 2.0.50727)\r\n
    Accept: en-us\r\n
    Content-Type: application/soap+xml\r\n
    Host: 10.170.80.156:9090\r\n
    Content-Length: 752\r\n
    Expect: 100-continue\r\n
    Connection: Close\r\n
    \r\n
    [Full request URI: http://10.170.80.156:9090/ws/km-wsdl/security/authentication_authorization]
    [HTTP request 2/2]
    [Response in frame: 710]
    File Data: 752 bytes
eXtensible Markup Language
    <?xml
        version="1.0"
        encoding="utf-8"
        ?>
    <SOAP-ENV:Envelope
        xmlns:SOAP-ENV="http://www.w3.org/2003/05/soap-envelope"
        xmlns:SOAP-ENC="http://www.w3.org/2003/05/soap-encoding"
        xmlns:xsi="http://www.w3.org/2001/XMLSchema-instance"
        xmlns:xsd="http://www.w3.org/2001/XMLSchema"
        xmlns:wsa="http://schemas.xmlsoap.org/ws/2004/08/addressing"
        xmlns:xop="http://www.w3.org/2004/08/xop/include"
        xmlns:ns1="http://www.kyoceramita.com/ws/km-wsdl/security/authentication_authorization">
        <SOAP-ENV:Header>
            <wsa:Action
                SOAP-ENV:mustUnderstand="true">
                http://www.kyoceramita.com/ws/km-wsdl/security/authentication_authorization/get_authentication_status
                </wsa:Action>
            </SOAP-ENV:Header>
        <SOAP-ENV:Body>
            <ns1:get_authentication_statusRequest/>
            </SOAP-ENV:Body>
        </SOAP-ENV:Envelope>

No.     Time           Source                Destination           Protocol Length Info
    710 7.634281       10.170.80.156         10.170.80.99          HTTP/XML 701    HTTP/1.1 200 OK 

Frame 710: 701 bytes on wire (5608 bits), 701 bytes captured (5608 bits) on interface 0
Ethernet II, Src: Kyocera_b1:75:be (00:c0:ee:b1:75:be), Dst: LiteonTe_0d:11:e8 (74:de:2b:0d:11:e8)
Internet Protocol Version 4, Src: 10.170.80.156, Dst: 10.170.80.99
Transmission Control Protocol, Src Port: 9090, Dst Port: 63733, Seq: 2946, Ack: 1080, Len: 647
[3 Reassembled TCP Segments (3567 bytes): #707(1460), #708(1460), #710(647)]
    [Frame: 707, payload: 0-1459 (1460 bytes)]
    [Frame: 708, payload: 1460-2919 (1460 bytes)]
    [Frame: 710, payload: 2920-3566 (647 bytes)]
    [Segment count: 3]
    [Reassembled TCP length: 3567]
    [Reassembled TCP Data: 485454502f312e3120323030204f4b0d0a5365727665723a...]
Hypertext Transfer Protocol
    HTTP/1.1 200 OK\r\n
    Server: gSOAP/2.8\r\n
    Content-Type: application/soap+xml; charset=utf-8\r\n
    Content-Length: 3437\r\n
    Connection: close\r\n
    \r\n
    [HTTP response 2/2]
    [Time since request: 0.005038000 seconds]
    [Prev response in frame: 700]
    [Request in frame: 702]
    File Data: 3437 bytes
eXtensible Markup Language
    <SOAP-ENV:Envelope
        xmlns:SOAP-ENV="http://www.w3.org/2003/05/soap-envelope"
        xmlns:SOAP-ENC="http://www.w3.org/2003/05/soap-encoding"
        xmlns:xsi="http://www.w3.org/2001/XMLSchema-instance"
        xmlns:xsd="http://www.w3.org/2001/XMLSchema"
        xmlns:c14n="http://www.w3.org/2001/10/xml-exc-c14n#"
        xmlns:wsu="http://docs.oasis-open.org/wss/2004/01/oasis-200401-wss-wssecurity-utility-1.0.xsd"
        xmlns:xenc="http://www.w3.org/2001/04/xmlenc#"
        xmlns:ds="http://www.w3.org/2000/09/xmldsig#"
        xmlns:wsse="http://docs.oasis-open.org/wss/2004/01/oasis-200401-wss-wssecurity-secext-1.0.xsd"
        xmlns:discovery="http://schemas.xmlsoap.org/ws/2005/04/discovery"
        xmlns:eventing="http://schemas.xmlsoap.org/ws/2004/08/eventing"
        xmlns:addressing="http://schemas.xmlsoap.org/ws/2004/08/addressing"
        xmlns:kmauth="http://www.kyoceramita.com/ws/km-wsdl/security/authentication_authorization"
        xmlns:xop="http://www.w3.org/2004/08/xop/include"
        xmlns:kmboxinfo="http://www.kyoceramita.com/ws/km-wsdl/setting/box_information"
        xmlns:wsdd="http://tempuri.org/wsdd.xsd"
        xmlns:wsa5="http://tempuri.org/wsa5.xsd"
        xmlns:kmstored="http://www.kyoceramita.com/ws/km-wsdl/job/stored_data_operation"
        xmlns:kmscn="http://www.kyoceramita.com/ws/km-wsdl/job/scan_operation"
        xmlns:kmuserlist="http://www.kyoceramita.com/ws/km-wsdl/setting/user_list"
        xmlns:kmaddrbook="http://www.kyoceramita.com/ws/km-wsdl/setting/address_book"
        xmlns:kmauthset="http://www.kyoceramita.com/ws/km-wsdl/setting/authentication_authorization_setting"
        xmlns:kmdevset="http://www.kyoceramita.com/ws/km-wsdl/setting/device_setting"
        xmlns:kmaccmgt="http://www.kyoceramita.com/ws/km-wsdl/setting/account_management"
        xmlns:kmcntinfo="http://www.kyoceramita.com/ws/km-wsdl/log/counter_information"
        xmlns:kmpanelset="http://www.kyoceramita.com/ws/km-wsdl/setting/panel_setting"
        xmlns:kmloginfo="http://www.kyoceramita.com/ws/km-wsdl/log/log_information"
        xmlns:kmjobmng="http://www.kyoceramita.com/ws/km-wsdl/job/job_management"
        xmlns:kmdevctrl="http://www.kyoceramita.com/ws/km-wsdl/information/device_control"
        xmlns:kmfaxset="http://www.kyoceramita.com/ws/km-wsdl/setting/fax_setting"
        xmlns:kmdevstts="http://www.kyoceramita.com/ws/km-wsdl/status/device_status"
        xmlns:kmhypasmgt="http://www.kyoceramita.com/ws/km-wsdl/extension/hypas_application_management"
        xmlns:kmcertmgt="http://www.kyoceramita.com/ws/km-wsdl/setting/certificate_management"
        xmlns:kmfirmwareupdate="http://www.kyoceramita.com/ws/km-wsdl/extension/firmware_update"
        xmlns:kmmaint="http://www.kyoceramita.com/ws/km-wsdl/information/maintenance"
        xmlns:kmdevinfo="http://www.kyoceramita.com/ws/km-wsdl/information/device_information">
        <SOAP-ENV:Header>
            <addressing:Action>
                http://www.kyoceramita.com/ws/km-wsdl/security/authentication_authorization/get_authentication_status
                </addressing:Action>
            </SOAP-ENV:Header>
        <SOAP-ENV:Body
            xml:space="preserve">
            <kmauth:get_authentication_statusResponse>
                <kmauth:authentication_method>
                    LOCAL_AUTHENTICATION
                    </kmauth:authentication_method>
                <kmauth:result>
                    SUCCESS
                    </kmauth:result>
                <kmauth:password_policy>
                    <kmauth:enable>
                        ON
                        </kmauth:enable>
                    <kmauth:password_randomness>
                        <kmauth:policy_1>
                            ON
                            </kmauth:policy_1>
                        <kmauth:policy_2>
                            NO_LIMITATION
                            </kmauth:policy_2>
                        <kmauth:policy_3>
                            NO_LIMITATION
                            </kmauth:policy_3>
                        <kmauth:policy_4>
                            NO_LIMITATION
                            </kmauth:policy_4>
                        <kmauth:policy_5>
                            NO_LIMITATION
                            </kmauth:policy_5>
                        </kmauth:password_randomness>
                    </kmauth:password_policy>
                </kmauth:get_authentication_statusResponse>
            </SOAP-ENV:Body>
        </SOAP-ENV:Envelope>

No.     Time           Source                Destination           Protocol Length Info
    730 7.671800       10.170.80.156         10.170.80.99          HTTP     60     HTTP/1.1 100 Continue 

Frame 730: 60 bytes on wire (480 bits), 60 bytes captured (480 bits) on interface 0
Ethernet II, Src: Kyocera_b1:75:be (00:c0:ee:b1:75:be), Dst: LiteonTe_0d:11:e8 (74:de:2b:0d:11:e8)
Internet Protocol Version 4, Src: 10.170.80.156, Dst: 10.170.80.99
Transmission Control Protocol, Src Port: 9090, Dst Port: 63734, Seq: 24, Ack: 328, Len: 2
[3 Reassembled TCP Segments (25 bytes): #727(21), #728(2), #730(2)]
    [Frame: 727, payload: 0-20 (21 bytes)]
    [Frame: 728, payload: 21-22 (2 bytes)]
    [Frame: 730, payload: 23-24 (2 bytes)]
    [Segment count: 3]
    [Reassembled TCP length: 25]
    [Reassembled TCP Data: 485454502f312e312031303020436f6e74696e75650d0a0d...]
Hypertext Transfer Protocol
    HTTP/1.1 100 Continue\r\n
    \r\n
    [HTTP response 1/2]
    [Next request in frame: 731]
    [Next response in frame: 745]

No.     Time           Source                Destination           Protocol Length Info
    731 7.671951       10.170.80.99          10.170.80.156         HTTP/XML 950    POST /ws/km-wsdl/security/authentication_authorization HTTP/1.1 

Frame 731: 950 bytes on wire (7600 bits), 950 bytes captured (7600 bits) on interface 0
Ethernet II, Src: LiteonTe_0d:11:e8 (74:de:2b:0d:11:e8), Dst: Kyocera_b1:75:be (00:c0:ee:b1:75:be)
Internet Protocol Version 4, Src: 10.170.80.99, Dst: 10.170.80.156
Transmission Control Protocol, Src Port: 63734, Dst Port: 9090, Seq: 328, Ack: 26, Len: 896
[2 Reassembled TCP Segments (1223 bytes): #725(327), #731(896)]
    [Frame: 725, payload: 0-326 (327 bytes)]
    [Frame: 731, payload: 327-1222 (896 bytes)]
    [Segment count: 2]
    [Reassembled TCP length: 1223]
    [Reassembled TCP Data: 504f5354202f77732f6b6d2d7773646c2f73656375726974...]
Hypertext Transfer Protocol
    POST /ws/km-wsdl/security/authentication_authorization HTTP/1.1\r\n
    User-Agent: Mozilla/4.0 (compatible; MSIE 6.0; Windows NT 5.1; SV1; ..NET CLR 1.1.4322; InfoPath.1; .NET CLR 2.0.50727)\r\n
    Accept: en-us\r\n
    Content-Type: application/soap+xml\r\n
    Host: 10.170.80.156:9090\r\n
    Content-Length: 896\r\n
    Expect: 100-continue\r\n
    Connection: Close\r\n
    \r\n
    [Full request URI: http://10.170.80.156:9090/ws/km-wsdl/security/authentication_authorization]
    [HTTP request 2/2]
    [Response in frame: 745]
    File Data: 896 bytes
eXtensible Markup Language
    <?xml
        version="1.0"
        encoding="utf-8"
        ?>
    <SOAP-ENV:Envelope
        xmlns:SOAP-ENV="http://www.w3.org/2003/05/soap-envelope"
        xmlns:SOAP-ENC="http://www.w3.org/2003/05/soap-encoding"
        xmlns:xsi="http://www.w3.org/2001/XMLSchema-instance"
        xmlns:xsd="http://www.w3.org/2001/XMLSchema"
        xmlns:wsa="http://schemas.xmlsoap.org/ws/2004/08/addressing"
        xmlns:xop="http://www.w3.org/2004/08/xop/include"
        xmlns:ns1="http://www.kyoceramita.com/ws/km-wsdl/security/authentication_authorization">
        <SOAP-ENV:Header>
            <wsa:Action
                SOAP-ENV:mustUnderstand="true">
                http://www.kyoceramita.com/ws/km-wsdl/security/authentication_authorization/login_system
                </wsa:Action>
            </SOAP-ENV:Header>
        <SOAP-ENV:Body>
            <ns1:login_systemRequest>
                <ns1:authentication_method>
                    LOCAL_AUTHENTICATION
                    </ns1:authentication_method>
                <ns1:userid>
                    Admin
                    </ns1:userid>
                <ns1:password>
                    +nSQsKXZpas=
                    </ns1:password>
                </ns1:login_systemRequest>
            </SOAP-ENV:Body>
        </SOAP-ENV:Envelope>

No.     Time           Source                Destination           Protocol Length Info
    745 7.709756       10.170.80.156         10.170.80.99          HTTP/XML 352    HTTP/1.1 200 OK 

Frame 745: 352 bytes on wire (2816 bits), 352 bytes captured (2816 bits) on interface 0
Ethernet II, Src: Kyocera_b1:75:be (00:c0:ee:b1:75:be), Dst: LiteonTe_0d:11:e8 (74:de:2b:0d:11:e8)
Internet Protocol Version 4, Src: 10.170.80.156, Dst: 10.170.80.99
Transmission Control Protocol, Src Port: 9090, Dst Port: 63734, Seq: 2946, Ack: 1224, Len: 298
[3 Reassembled TCP Segments (3218 bytes): #742(1460), #743(1460), #745(298)]
    [Frame: 742, payload: 0-1459 (1460 bytes)]
    [Frame: 743, payload: 1460-2919 (1460 bytes)]
    [Frame: 745, payload: 2920-3217 (298 bytes)]
    [Segment count: 3]
    [Reassembled TCP length: 3218]
    [Reassembled TCP Data: 485454502f312e3120323030204f4b0d0a5365727665723a...]
Hypertext Transfer Protocol
    HTTP/1.1 200 OK\r\n
    Server: gSOAP/2.8\r\n
    Content-Type: application/soap+xml; charset=utf-8\r\n
    Content-Length: 3088\r\n
    Connection: close\r\n
    \r\n
    [HTTP response 2/2]
    [Time since request: 0.037805000 seconds]
    [Prev response in frame: 730]
    [Request in frame: 731]
    File Data: 3088 bytes
eXtensible Markup Language
    <SOAP-ENV:Envelope
        xmlns:SOAP-ENV="http://www.w3.org/2003/05/soap-envelope"
        xmlns:SOAP-ENC="http://www.w3.org/2003/05/soap-encoding"
        xmlns:xsi="http://www.w3.org/2001/XMLSchema-instance"
        xmlns:xsd="http://www.w3.org/2001/XMLSchema"
        xmlns:c14n="http://www.w3.org/2001/10/xml-exc-c14n#"
        xmlns:wsu="http://docs.oasis-open.org/wss/2004/01/oasis-200401-wss-wssecurity-utility-1.0.xsd"
        xmlns:xenc="http://www.w3.org/2001/04/xmlenc#"
        xmlns:ds="http://www.w3.org/2000/09/xmldsig#"
        xmlns:wsse="http://docs.oasis-open.org/wss/2004/01/oasis-200401-wss-wssecurity-secext-1.0.xsd"
        xmlns:discovery="http://schemas.xmlsoap.org/ws/2005/04/discovery"
        xmlns:eventing="http://schemas.xmlsoap.org/ws/2004/08/eventing"
        xmlns:addressing="http://schemas.xmlsoap.org/ws/2004/08/addressing"
        xmlns:kmauth="http://www.kyoceramita.com/ws/km-wsdl/security/authentication_authorization"
        xmlns:xop="http://www.w3.org/2004/08/xop/include"
        xmlns:kmboxinfo="http://www.kyoceramita.com/ws/km-wsdl/setting/box_information"
        xmlns:wsdd="http://tempuri.org/wsdd.xsd"
        xmlns:wsa5="http://tempuri.org/wsa5.xsd"
        xmlns:kmstored="http://www.kyoceramita.com/ws/km-wsdl/job/stored_data_operation"
        xmlns:kmscn="http://www.kyoceramita.com/ws/km-wsdl/job/scan_operation"
        xmlns:kmuserlist="http://www.kyoceramita.com/ws/km-wsdl/setting/user_list"
        xmlns:kmaddrbook="http://www.kyoceramita.com/ws/km-wsdl/setting/address_book"
        xmlns:kmauthset="http://www.kyoceramita.com/ws/km-wsdl/setting/authentication_authorization_setting"
        xmlns:kmdevset="http://www.kyoceramita.com/ws/km-wsdl/setting/device_setting"
        xmlns:kmaccmgt="http://www.kyoceramita.com/ws/km-wsdl/setting/account_management"
        xmlns:kmcntinfo="http://www.kyoceramita.com/ws/km-wsdl/log/counter_information"
        xmlns:kmpanelset="http://www.kyoceramita.com/ws/km-wsdl/setting/panel_setting"
        xmlns:kmloginfo="http://www.kyoceramita.com/ws/km-wsdl/log/log_information"
        xmlns:kmjobmng="http://www.kyoceramita.com/ws/km-wsdl/job/job_management"
        xmlns:kmdevctrl="http://www.kyoceramita.com/ws/km-wsdl/information/device_control"
        xmlns:kmfaxset="http://www.kyoceramita.com/ws/km-wsdl/setting/fax_setting"
        xmlns:kmdevstts="http://www.kyoceramita.com/ws/km-wsdl/status/device_status"
        xmlns:kmhypasmgt="http://www.kyoceramita.com/ws/km-wsdl/extension/hypas_application_management"
        xmlns:kmcertmgt="http://www.kyoceramita.com/ws/km-wsdl/setting/certificate_management"
        xmlns:kmfirmwareupdate="http://www.kyoceramita.com/ws/km-wsdl/extension/firmware_update"
        xmlns:kmmaint="http://www.kyoceramita.com/ws/km-wsdl/information/maintenance"
        xmlns:kmdevinfo="http://www.kyoceramita.com/ws/km-wsdl/information/device_information">
        <SOAP-ENV:Header>
            <addressing:Action>
                http://www.kyoceramita.com/ws/km-wsdl/security/authentication_authorization/login_system
                </addressing:Action>
            </SOAP-ENV:Header>
        <SOAP-ENV:Body
            xml:space="preserve">
            <kmauth:login_systemResponse>
                <kmauth:usertoken>
                    <kmauth:encode>
                        BASE64
                        </kmauth:encode>
                    <kmauth:token>
                        MjdmZDk2OWZMSjYzOTAwMDA0MDAwMDAwMDI=
                        </kmauth:token>
                    </kmauth:usertoken>
                <kmauth:result>
                    SUCCESS
                    </kmauth:result>
                </kmauth:login_systemResponse>
            </SOAP-ENV:Body>
        </SOAP-ENV:Envelope>

No.     Time           Source                Destination           Protocol Length Info
    766 7.734399       10.170.80.156         10.170.80.99          HTTP     60     HTTP/1.1 100 Continue 

Frame 766: 60 bytes on wire (480 bits), 60 bytes captured (480 bits) on interface 0
Ethernet II, Src: Kyocera_b1:75:be (00:c0:ee:b1:75:be), Dst: LiteonTe_0d:11:e8 (74:de:2b:0d:11:e8)
Internet Protocol Version 4, Src: 10.170.80.156, Dst: 10.170.80.99
Transmission Control Protocol, Src Port: 9090, Dst Port: 63735, Seq: 24, Ack: 329, Len: 2
[3 Reassembled TCP Segments (25 bytes): #758(21), #764(2), #766(2)]
    [Frame: 758, payload: 0-20 (21 bytes)]
    [Frame: 764, payload: 21-22 (2 bytes)]
    [Frame: 766, payload: 23-24 (2 bytes)]
    [Segment count: 3]
    [Reassembled TCP length: 25]
    [Reassembled TCP Data: 485454502f312e312031303020436f6e74696e75650d0a0d...]
Hypertext Transfer Protocol
    HTTP/1.1 100 Continue\r\n
    \r\n
    [HTTP response 1/2]
    [Next request in frame: 767]
    [Next response in frame: 772]

No.     Time           Source                Destination           Protocol Length Info
    767 7.734547       10.170.80.99          10.170.80.156         HTTP/XML 1127   POST /ws/km-wsdl/security/authentication_authorization HTTP/1.1 

Frame 767: 1127 bytes on wire (9016 bits), 1127 bytes captured (9016 bits) on interface 0
Ethernet II, Src: LiteonTe_0d:11:e8 (74:de:2b:0d:11:e8), Dst: Kyocera_b1:75:be (00:c0:ee:b1:75:be)
Internet Protocol Version 4, Src: 10.170.80.99, Dst: 10.170.80.156
Transmission Control Protocol, Src Port: 63735, Dst Port: 9090, Seq: 329, Ack: 26, Len: 1073
[2 Reassembled TCP Segments (1401 bytes): #755(328), #767(1073)]
    [Frame: 755, payload: 0-327 (328 bytes)]
    [Frame: 767, payload: 328-1400 (1073 bytes)]
    [Segment count: 2]
    [Reassembled TCP length: 1401]
    [Reassembled TCP Data: 504f5354202f77732f6b6d2d7773646c2f73656375726974...]
Hypertext Transfer Protocol
    POST /ws/km-wsdl/security/authentication_authorization HTTP/1.1\r\n
    User-Agent: Mozilla/4.0 (compatible; MSIE 6.0; Windows NT 5.1; SV1; ..NET CLR 1.1.4322; InfoPath.1; .NET CLR 2.0.50727)\r\n
    Accept: en-us\r\n
    Content-Type: application/soap+xml\r\n
    Host: 10.170.80.156:9090\r\n
    Content-Length: 1073\r\n
    Expect: 100-continue\r\n
    Connection: Close\r\n
    \r\n
    [Full request URI: http://10.170.80.156:9090/ws/km-wsdl/security/authentication_authorization]
    [HTTP request 2/2]
    [Response in frame: 772]
    File Data: 1073 bytes
eXtensible Markup Language
    <?xml
        version="1.0"
        encoding="utf-8"
        ?>
    <SOAP-ENV:Envelope
        xmlns:SOAP-ENV="http://www.w3.org/2003/05/soap-envelope"
        xmlns:SOAP-ENC="http://www.w3.org/2003/05/soap-encoding"
        xmlns:xsi="http://www.w3.org/2001/XMLSchema-instance"
        xmlns:xsd="http://www.w3.org/2001/XMLSchema"
        xmlns:wsa="http://schemas.xmlsoap.org/ws/2004/08/addressing"
        xmlns:xop="http://www.w3.org/2004/08/xop/include"
        xmlns:ns1="http://www.kyoceramita.com/ws/km-wsdl/security/authentication_authorization">
        <SOAP-ENV:Header>
            <wsa:Action
                SOAP-ENV:mustUnderstand="true">
                http://www.kyoceramita.com/ws/km-wsdl/security/authentication_authorization/get_user_information
                </wsa:Action>
            </SOAP-ENV:Header>
        <SOAP-ENV:Body>
            <ns1:get_user_informationRequest>
                <ns1:usertoken>
                    <ns1:encode
                        xmlns="http://www.kyoceramita.com/ws/km-wsdl/security/authentication_authorization">
                        BASE64
                        </ns1:encode>
                    <ns1:token
                        xmlns="http://www.kyoceramita.com/ws/km-wsdl/security/authentication_authorization">
                        MjdmZDk2OWZMSjYzOTAwMDA0MDAwMDAwMDI=
                        </ns1:token>
                    </ns1:usertoken>
                </ns1:get_user_informationRequest>
            </SOAP-ENV:Body>
        </SOAP-ENV:Envelope>

No.     Time           Source                Destination           Protocol Length Info
    772 7.742915       10.170.80.156         10.170.80.99          HTTP/XML 329    HTTP/1.1 200 OK 

Frame 772: 329 bytes on wire (2632 bits), 329 bytes captured (2632 bits) on interface 0
Ethernet II, Src: Kyocera_b1:75:be (00:c0:ee:b1:75:be), Dst: LiteonTe_0d:11:e8 (74:de:2b:0d:11:e8)
Internet Protocol Version 4, Src: 10.170.80.156, Dst: 10.170.80.99
Transmission Control Protocol, Src Port: 9090, Dst Port: 63735, Seq: 4406, Ack: 1402, Len: 275
[4 Reassembled TCP Segments (4655 bytes): #768(1460), #769(1460), #771(1460), #772(275)]
    [Frame: 768, payload: 0-1459 (1460 bytes)]
    [Frame: 769, payload: 1460-2919 (1460 bytes)]
    [Frame: 771, payload: 2920-4379 (1460 bytes)]
    [Frame: 772, payload: 4380-4654 (275 bytes)]
    [Segment count: 4]
    [Reassembled TCP length: 4655]
    [Reassembled TCP Data: 485454502f312e3120323030204f4b0d0a5365727665723a...]
Hypertext Transfer Protocol
    HTTP/1.1 200 OK\r\n
    Server: gSOAP/2.8\r\n
    Content-Type: application/soap+xml; charset=utf-8\r\n
    Content-Length: 4525\r\n
    Connection: close\r\n
    \r\n
    [HTTP response 2/2]
    [Time since request: 0.008368000 seconds]
    [Prev response in frame: 766]
    [Request in frame: 767]
    File Data: 4525 bytes
eXtensible Markup Language
    <SOAP-ENV:Envelope
        xmlns:SOAP-ENV="http://www.w3.org/2003/05/soap-envelope"
        xmlns:SOAP-ENC="http://www.w3.org/2003/05/soap-encoding"
        xmlns:xsi="http://www.w3.org/2001/XMLSchema-instance"
        xmlns:xsd="http://www.w3.org/2001/XMLSchema"
        xmlns:c14n="http://www.w3.org/2001/10/xml-exc-c14n#"
        xmlns:wsu="http://docs.oasis-open.org/wss/2004/01/oasis-200401-wss-wssecurity-utility-1.0.xsd"
        xmlns:xenc="http://www.w3.org/2001/04/xmlenc#"
        xmlns:ds="http://www.w3.org/2000/09/xmldsig#"
        xmlns:wsse="http://docs.oasis-open.org/wss/2004/01/oasis-200401-wss-wssecurity-secext-1.0.xsd"
        xmlns:discovery="http://schemas.xmlsoap.org/ws/2005/04/discovery"
        xmlns:eventing="http://schemas.xmlsoap.org/ws/2004/08/eventing"
        xmlns:addressing="http://schemas.xmlsoap.org/ws/2004/08/addressing"
        xmlns:kmauth="http://www.kyoceramita.com/ws/km-wsdl/security/authentication_authorization"
        xmlns:xop="http://www.w3.org/2004/08/xop/include"
        xmlns:kmboxinfo="http://www.kyoceramita.com/ws/km-wsdl/setting/box_information"
        xmlns:wsdd="http://tempuri.org/wsdd.xsd"
        xmlns:wsa5="http://tempuri.org/wsa5.xsd"
        xmlns:kmstored="http://www.kyoceramita.com/ws/km-wsdl/job/stored_data_operation"
        xmlns:kmscn="http://www.kyoceramita.com/ws/km-wsdl/job/scan_operation"
        xmlns:kmuserlist="http://www.kyoceramita.com/ws/km-wsdl/setting/user_list"
        xmlns:kmaddrbook="http://www.kyoceramita.com/ws/km-wsdl/setting/address_book"
        xmlns:kmauthset="http://www.kyoceramita.com/ws/km-wsdl/setting/authentication_authorization_setting"
        xmlns:kmdevset="http://www.kyoceramita.com/ws/km-wsdl/setting/device_setting"
        xmlns:kmaccmgt="http://www.kyoceramita.com/ws/km-wsdl/setting/account_management"
        xmlns:kmcntinfo="http://www.kyoceramita.com/ws/km-wsdl/log/counter_information"
        xmlns:kmpanelset="http://www.kyoceramita.com/ws/km-wsdl/setting/panel_setting"
        xmlns:kmloginfo="http://www.kyoceramita.com/ws/km-wsdl/log/log_information"
        xmlns:kmjobmng="http://www.kyoceramita.com/ws/km-wsdl/job/job_management"
        xmlns:kmdevctrl="http://www.kyoceramita.com/ws/km-wsdl/information/device_control"
        xmlns:kmfaxset="http://www.kyoceramita.com/ws/km-wsdl/setting/fax_setting"
        xmlns:kmdevstts="http://www.kyoceramita.com/ws/km-wsdl/status/device_status"
        xmlns:kmhypasmgt="http://www.kyoceramita.com/ws/km-wsdl/extension/hypas_application_management"
        xmlns:kmcertmgt="http://www.kyoceramita.com/ws/km-wsdl/setting/certificate_management"
        xmlns:kmfirmwareupdate="http://www.kyoceramita.com/ws/km-wsdl/extension/firmware_update"
        xmlns:kmmaint="http://www.kyoceramita.com/ws/km-wsdl/information/maintenance"
        xmlns:kmdevinfo="http://www.kyoceramita.com/ws/km-wsdl/information/device_information">
        <SOAP-ENV:Header>
            <addressing:Action>
                http://www.kyoceramita.com/ws/km-wsdl/security/authentication_authorization/get_user_information
                </addressing:Action>
            </SOAP-ENV:Header>
        <SOAP-ENV:Body
            xml:space="preserve">
            <kmauth:get_user_informationResponse>
                <kmauth:user_information>
                    <kmauth:access_level>
                        ADMINISTRATOR
                        </kmauth:access_level>
                    <kmauth:user_name>
                        Admin
                        </kmauth:user_name>
                    <kmauth:job_authorization>
                        <kmauth:print_restriction_black_and_white>
                            PERMIT
                            </kmauth:print_restriction_black_and_white>
                        <kmauth:print_restriction_full_color>
                            PERMIT
                            </kmauth:print_restriction_full_color>
                        <kmauth:copy_restriction_black_and_white>
                            PERMIT
                            </kmauth:copy_restriction_black_and_white>
                        <kmauth:copy_restriction_single_color>
                            PERMIT
                            </kmauth:copy_restriction_single_color>
                        <kmauth:copy_restriction_full_color>
                            PERMIT
                            </kmauth:copy_restriction_full_color>
                        <kmauth:send_restriction>
                            PERMIT
                            </kmauth:send_restriction>
                        <kmauth:fax_send_restriction>
                            PERMIT
                            </kmauth:fax_send_restriction>
                        <kmauth:storing_restriction_in_box>
                            PERMIT
                            </kmauth:storing_restriction_in_box>
                        <kmauth:storing_restriction_in_memory>
                            PERMIT
                            </kmauth:storing_restriction_in_memory>
                        <kmauth:copy_print_duplex>
                            ONLY_USE_DUPLEX
                            </kmauth:copy_print_duplex>
                        <kmauth:copy_print_combine>
                            NO_LIMITATION
                            </kmauth:copy_print_combine>
                        <kmauth:copy_print_ecoprint>
                            ONLY_USE_ECOPRINT
                            </kmauth:copy_print_ecoprint>
                        </kmauth:job_authorization>
                    <kmauth:password_registration_time>
                        <kmauth:second>
                            2
                            </kmauth:second>
                        <kmauth:minute>
                            45
                            </kmauth:minute>
                        <kmauth:hour>
                            15
                            </kmauth:hour>
                        <kmauth:day>
                            27
                            </kmauth:day>
                        <kmauth:month>
                            0
                            </kmauth:month>
                        <kmauth:year>
                            116
                            </kmauth:year>
                        <kmauth:wday>
                            3
                            </kmauth:wday>
                        <kmauth:yday>
                            26
                            </kmauth:yday>
                        <kmauth:is_dst>
                            0
                            </kmauth:is_dst>
                        <kmauth:time_zone>
                            800
                            </kmauth:time_zone>
                        </kmauth:password_registration_time>
                    <kmauth:password_validity>
                        0
                        </kmauth:password_validity>
                    </kmauth:user_information>
                <kmauth:result>
                    SUCCESS
                    </kmauth:result>
                </kmauth:get_user_informationResponse>
            </SOAP-ENV:Body>
        </SOAP-ENV:Envelope>

No.     Time           Source                Destination           Protocol Length Info
    786 7.823200       10.170.80.156         10.170.80.99          HTTP     60     HTTP/1.1 100 Continue 

Frame 786: 60 bytes on wire (480 bits), 60 bytes captured (480 bits) on interface 0
Ethernet II, Src: Kyocera_b1:75:be (00:c0:ee:b1:75:be), Dst: LiteonTe_0d:11:e8 (74:de:2b:0d:11:e8)
Internet Protocol Version 4, Src: 10.170.80.156, Dst: 10.170.80.99
Transmission Control Protocol, Src Port: 9090, Dst Port: 63736, Seq: 24, Ack: 328, Len: 2
[3 Reassembled TCP Segments (25 bytes): #783(21), #784(2), #786(2)]
    [Frame: 783, payload: 0-20 (21 bytes)]
    [Frame: 784, payload: 21-22 (2 bytes)]
    [Frame: 786, payload: 23-24 (2 bytes)]
    [Segment count: 3]
    [Reassembled TCP length: 25]
    [Reassembled TCP Data: 485454502f312e312031303020436f6e74696e75650d0a0d...]
Hypertext Transfer Protocol
    HTTP/1.1 100 Continue\r\n
    \r\n
    [HTTP response 1/2]
    [Next request in frame: 787]
    [Next response in frame: 791]

No.     Time           Source                Destination           Protocol Length Info
    787 7.823386       10.170.80.99          10.170.80.156         HTTP/XML 806    POST /ws/km-wsdl/security/authentication_authorization HTTP/1.1 

Frame 787: 806 bytes on wire (6448 bits), 806 bytes captured (6448 bits) on interface 0
Ethernet II, Src: LiteonTe_0d:11:e8 (74:de:2b:0d:11:e8), Dst: Kyocera_b1:75:be (00:c0:ee:b1:75:be)
Internet Protocol Version 4, Src: 10.170.80.99, Dst: 10.170.80.156
Transmission Control Protocol, Src Port: 63736, Dst Port: 9090, Seq: 328, Ack: 26, Len: 752
[2 Reassembled TCP Segments (1079 bytes): #781(327), #787(752)]
    [Frame: 781, payload: 0-326 (327 bytes)]
    [Frame: 787, payload: 327-1078 (752 bytes)]
    [Segment count: 2]
    [Reassembled TCP length: 1079]
    [Reassembled TCP Data: 504f5354202f77732f6b6d2d7773646c2f73656375726974...]
Hypertext Transfer Protocol
    POST /ws/km-wsdl/security/authentication_authorization HTTP/1.1\r\n
    User-Agent: Mozilla/4.0 (compatible; MSIE 6.0; Windows NT 5.1; SV1; ..NET CLR 1.1.4322; InfoPath.1; .NET CLR 2.0.50727)\r\n
    Accept: en-us\r\n
    Content-Type: application/soap+xml\r\n
    Host: 10.170.80.156:9090\r\n
    Content-Length: 752\r\n
    Expect: 100-continue\r\n
    Connection: Close\r\n
    \r\n
    [Full request URI: http://10.170.80.156:9090/ws/km-wsdl/security/authentication_authorization]
    [HTTP request 2/2]
    [Response in frame: 791]
    File Data: 752 bytes
eXtensible Markup Language
    <?xml
        version="1.0"
        encoding="utf-8"
        ?>
    <SOAP-ENV:Envelope
        xmlns:SOAP-ENV="http://www.w3.org/2003/05/soap-envelope"
        xmlns:SOAP-ENC="http://www.w3.org/2003/05/soap-encoding"
        xmlns:xsi="http://www.w3.org/2001/XMLSchema-instance"
        xmlns:xsd="http://www.w3.org/2001/XMLSchema"
        xmlns:wsa="http://schemas.xmlsoap.org/ws/2004/08/addressing"
        xmlns:xop="http://www.w3.org/2004/08/xop/include"
        xmlns:ns1="http://www.kyoceramita.com/ws/km-wsdl/security/authentication_authorization">
        <SOAP-ENV:Header>
            <wsa:Action
                SOAP-ENV:mustUnderstand="true">
                http://www.kyoceramita.com/ws/km-wsdl/security/authentication_authorization/get_authentication_status
                </wsa:Action>
            </SOAP-ENV:Header>
        <SOAP-ENV:Body>
            <ns1:get_authentication_statusRequest/>
            </SOAP-ENV:Body>
        </SOAP-ENV:Envelope>

No.     Time           Source                Destination           Protocol Length Info
    791 7.836832       10.170.80.156         10.170.80.99          HTTP/XML 701    HTTP/1.1 200 OK 

Frame 791: 701 bytes on wire (5608 bits), 701 bytes captured (5608 bits) on interface 0
Ethernet II, Src: Kyocera_b1:75:be (00:c0:ee:b1:75:be), Dst: LiteonTe_0d:11:e8 (74:de:2b:0d:11:e8)
Internet Protocol Version 4, Src: 10.170.80.156, Dst: 10.170.80.99
Transmission Control Protocol, Src Port: 9090, Dst Port: 63736, Seq: 2946, Ack: 1080, Len: 647
[3 Reassembled TCP Segments (3567 bytes): #788(1460), #789(1460), #791(647)]
    [Frame: 788, payload: 0-1459 (1460 bytes)]
    [Frame: 789, payload: 1460-2919 (1460 bytes)]
    [Frame: 791, payload: 2920-3566 (647 bytes)]
    [Segment count: 3]
    [Reassembled TCP length: 3567]
    [Reassembled TCP Data: 485454502f312e3120323030204f4b0d0a5365727665723a...]
Hypertext Transfer Protocol
    HTTP/1.1 200 OK\r\n
    Server: gSOAP/2.8\r\n
    Content-Type: application/soap+xml; charset=utf-8\r\n
    Content-Length: 3437\r\n
    Connection: close\r\n
    \r\n
    [HTTP response 2/2]
    [Time since request: 0.013446000 seconds]
    [Prev response in frame: 786]
    [Request in frame: 787]
    File Data: 3437 bytes
eXtensible Markup Language
    <SOAP-ENV:Envelope
        xmlns:SOAP-ENV="http://www.w3.org/2003/05/soap-envelope"
        xmlns:SOAP-ENC="http://www.w3.org/2003/05/soap-encoding"
        xmlns:xsi="http://www.w3.org/2001/XMLSchema-instance"
        xmlns:xsd="http://www.w3.org/2001/XMLSchema"
        xmlns:c14n="http://www.w3.org/2001/10/xml-exc-c14n#"
        xmlns:wsu="http://docs.oasis-open.org/wss/2004/01/oasis-200401-wss-wssecurity-utility-1.0.xsd"
        xmlns:xenc="http://www.w3.org/2001/04/xmlenc#"
        xmlns:ds="http://www.w3.org/2000/09/xmldsig#"
        xmlns:wsse="http://docs.oasis-open.org/wss/2004/01/oasis-200401-wss-wssecurity-secext-1.0.xsd"
        xmlns:discovery="http://schemas.xmlsoap.org/ws/2005/04/discovery"
        xmlns:eventing="http://schemas.xmlsoap.org/ws/2004/08/eventing"
        xmlns:addressing="http://schemas.xmlsoap.org/ws/2004/08/addressing"
        xmlns:kmauth="http://www.kyoceramita.com/ws/km-wsdl/security/authentication_authorization"
        xmlns:xop="http://www.w3.org/2004/08/xop/include"
        xmlns:kmboxinfo="http://www.kyoceramita.com/ws/km-wsdl/setting/box_information"
        xmlns:wsdd="http://tempuri.org/wsdd.xsd"
        xmlns:wsa5="http://tempuri.org/wsa5.xsd"
        xmlns:kmstored="http://www.kyoceramita.com/ws/km-wsdl/job/stored_data_operation"
        xmlns:kmscn="http://www.kyoceramita.com/ws/km-wsdl/job/scan_operation"
        xmlns:kmuserlist="http://www.kyoceramita.com/ws/km-wsdl/setting/user_list"
        xmlns:kmaddrbook="http://www.kyoceramita.com/ws/km-wsdl/setting/address_book"
        xmlns:kmauthset="http://www.kyoceramita.com/ws/km-wsdl/setting/authentication_authorization_setting"
        xmlns:kmdevset="http://www.kyoceramita.com/ws/km-wsdl/setting/device_setting"
        xmlns:kmaccmgt="http://www.kyoceramita.com/ws/km-wsdl/setting/account_management"
        xmlns:kmcntinfo="http://www.kyoceramita.com/ws/km-wsdl/log/counter_information"
        xmlns:kmpanelset="http://www.kyoceramita.com/ws/km-wsdl/setting/panel_setting"
        xmlns:kmloginfo="http://www.kyoceramita.com/ws/km-wsdl/log/log_information"
        xmlns:kmjobmng="http://www.kyoceramita.com/ws/km-wsdl/job/job_management"
        xmlns:kmdevctrl="http://www.kyoceramita.com/ws/km-wsdl/information/device_control"
        xmlns:kmfaxset="http://www.kyoceramita.com/ws/km-wsdl/setting/fax_setting"
        xmlns:kmdevstts="http://www.kyoceramita.com/ws/km-wsdl/status/device_status"
        xmlns:kmhypasmgt="http://www.kyoceramita.com/ws/km-wsdl/extension/hypas_application_management"
        xmlns:kmcertmgt="http://www.kyoceramita.com/ws/km-wsdl/setting/certificate_management"
        xmlns:kmfirmwareupdate="http://www.kyoceramita.com/ws/km-wsdl/extension/firmware_update"
        xmlns:kmmaint="http://www.kyoceramita.com/ws/km-wsdl/information/maintenance"
        xmlns:kmdevinfo="http://www.kyoceramita.com/ws/km-wsdl/information/device_information">
        <SOAP-ENV:Header>
            <addressing:Action>
                http://www.kyoceramita.com/ws/km-wsdl/security/authentication_authorization/get_authentication_status
                </addressing:Action>
            </SOAP-ENV:Header>
        <SOAP-ENV:Body
            xml:space="preserve">
            <kmauth:get_authentication_statusResponse>
                <kmauth:authentication_method>
                    LOCAL_AUTHENTICATION
                    </kmauth:authentication_method>
                <kmauth:result>
                    SUCCESS
                    </kmauth:result>
                <kmauth:password_policy>
                    <kmauth:enable>
                        ON
                        </kmauth:enable>
                    <kmauth:password_randomness>
                        <kmauth:policy_1>
                            ON
                            </kmauth:policy_1>
                        <kmauth:policy_2>
                            NO_LIMITATION
                            </kmauth:policy_2>
                        <kmauth:policy_3>
                            NO_LIMITATION
                            </kmauth:policy_3>
                        <kmauth:policy_4>
                            NO_LIMITATION
                            </kmauth:policy_4>
                        <kmauth:policy_5>
                            NO_LIMITATION
                            </kmauth:policy_5>
                        </kmauth:password_randomness>
